{
  "char_end": 458,
  "char_start": 16,
  "chunk_config": "A",
  "chunk_id": "chunk_0172fee4424d1983fae89880",
  "chunk_index": 0,
  "content_type": "attraction",
  "district_id": "district_fatih",
  "heading_path": [
    "آيا صوفيا",
    "تاريخ البناء"
  ],
  "language": "ar",
  "poi_id": "poi_hagia_sophia",
  "schema_version": "1.0.0",
  "source_checksum": "da0baa5eb934ff7932cf97af5f55f024ea1afe0d62aae226e3966059dcff1e7d",
  "source_id": "wiki_ar_hagia_sophia",
  "text": "تمثل آيا صوفيا الحالية ثالث هيكل رئيسي بُني في موقعها بالقسطنطينية. الكنيسة الأولى شُيدت حوالي سنة 360 ميلادية في عهد قسطنطين الثاني، واحترقت خلال أعمال الشغب في سنة 404. كنيسة ثانية بناها ثيودوسيوس الثاني (415-532) دُمرت في انتفاضة نيكا سنة 532. الهيكل الحالي كلّف به الإمبراطور جستنيان الأول وشُيد بين سنتي 532 و537 ميلادية. صمم المبنى المهندسان إيسيدوروس الميليتي وأنثيميوس الترالسي، واستُخدم أكثر من 10,000 عامل على مدى خمس سنوات متواصلة.",
  "token_count": 71
}
